<?xml version = "1.0" encoding = "UTF-8"?>

<cv xmlns:xsi="http://www.w3.org/2001/XMLSchema-instance" 
	xsi:noNamespaceSchemaLocation="MARCAS_UT3_P2_Sergio_Bravo_Mora.xsd">

    <nombre>Steve Jobs</nombre>
    <apodo/>
    <direcciones> 
        <direccion numero="1">
            <calle>770 de Welch Rd., Ste</calle>
            <numero>154</numero>
            <ciudad>Palo Alto</ciudad>
        </direccion>
        <direccion numero="2">
            <calle>Desengaño</calle>
            <numero>21</numero>
            <ciudad>Madrid</ciudad>
        </direccion>
    </direcciones>
    <telefono>685097256</telefono>
    <email>stevijobs@gmail.com</email>
    <email>eljefedeapple@gmail.com</email>
    <idiomas>
        <idioma>Japones</idioma>
        <idioma nivel="A2">Español</idioma>
        <idioma nivel="B2">Alemán</idioma>
        <idioma nivel="C2">Inglés</idioma>
    </idiomas>
</cv>